{"$schema":"https://json-schema.org/draft/2020-12/schema","$id":"https://depguard.dev/schemas/compatibility-evidence/v1.schema.json","title":"DepGuard Compatibility Evidence v1","type":"object","additionalProperties":false,"required":["schema","subject","environment","artifacts","verification","observations","externalIntelligence","policy","capabilities","methodology","missingEvidence"],"properties":{"schema":{"const":"1"},"subject":{"$ref":"#/$defs/subject"},"environment":{"$ref":"#/$defs/environment"},"artifacts":{"$ref":"#/$defs/artifacts"},"verification":{"type":"object","additionalProperties":{"type":"array","items":{"$ref":"#/$defs/command"}}},"observations":{"$ref":"#/$defs/observations"},"externalIntelligence":{"type":"array","items":{"$ref":"#/$defs/intelligence"}},"policy":{"$ref":"#/$defs/policy"},"capabilities":{"$ref":"#/$defs/capabilities"},"methodology":{"$ref":"#/$defs/methodology"},"missingEvidence":{"type":"array","items":{"$ref":"#/$defs/missingEvidence"}}},"$defs":{"digest":{"type":"string","pattern":"^sha256:[a-f0-9]{64}$"},"package":{"type":"object","additionalProperties":false,"required":["version","purl"],"properties":{"version":{"type":"string","minLength":1},"purl":{"type":"string","pattern":"^pkg:"}}},"subject":{"type":"object","additionalProperties":false,"required":["ecosystem","package","baseline","candidate"],"properties":{"ecosystem":{"type":"string","minLength":1},"package":{"type":"string","minLength":1},"baseline":{"$ref":"#/$defs/package"},"candidate":{"$ref":"#/$defs/package"}}},"environment":{"type":"object","additionalProperties":false,"required":["os","architecture","runtime","packageManager","sandboxBackend","containerImageReference","containerImageDigest"],"properties":{"os":{"type":"string","minLength":1},"architecture":{"type":"string","minLength":1},"runtime":{"type":"string","minLength":1},"packageManager":{"type":"string","minLength":1},"sandboxBackend":{"type":"string","minLength":1},"containerImageReference":{"type":"string","minLength":1},"containerImageDigest":{"type":["string","null"]}}},"artifacts":{"type":"object","additionalProperties":false,"required":["baselineArtifactDigest","candidateArtifactDigest","baselineRegistryIntegrity","candidateRegistryIntegrity","baselineLockfileDigest","candidateLockfileDigest","baselineDependencyGraphDigest","candidateDependencyGraphDigest","behaviorEvidenceDigest"],"properties":{"baselineArtifactDigest":{"$ref":"#/$defs/digest"},"candidateArtifactDigest":{"$ref":"#/$defs/digest"},"baselineRegistryIntegrity":{"type":["string","null"]},"candidateRegistryIntegrity":{"type":["string","null"]},"baselineLockfileDigest":{"$ref":"#/$defs/digest"},"candidateLockfileDigest":{"$ref":"#/$defs/digest"},"baselineDependencyGraphDigest":{"$ref":"#/$defs/digest"},"candidateDependencyGraphDigest":{"$ref":"#/$defs/digest"},"behaviorEvidenceDigest":{"$ref":"#/$defs/digest"}}},"command":{"type":"object","additionalProperties":false,"required":["name","status","exitCode"],"properties":{"name":{"type":"string"},"status":{"enum":["PASSED","FAILED","NOT_CONFIGURED","TIMEOUT","ERROR"]},"exitCode":{"type":["integer","null"]}}},"file":{"type":"object","additionalProperties":false,"required":["path","kind","size","sha256","executable"],"properties":{"path":{"type":"string"},"kind":{"type":"string"},"size":{"type":"integer","minimum":0},"sha256":{"type":["string","null"]},"executable":{"type":"boolean"}}},"process":{"type":"object","additionalProperties":false,"required":["executable","arguments","parent_executable","exit_code"],"properties":{"executable":{"type":"string"},"arguments":{"type":"array","items":{"type":"string"}},"parent_executable":{"type":["string","null"]},"exit_code":{"type":["integer","null"]}}},"metric":{"type":"object","additionalProperties":false,"required":["status","milliseconds"],"properties":{"status":{"enum":["OBSERVED","UNAVAILABLE"]},"milliseconds":{"type":["integer","null"],"minimum":0}}},"resources":{"type":"object","additionalProperties":false,"required":["wallTime","peakMemory","cpu"],"properties":{"wallTime":{"$ref":"#/$defs/metric"},"peakMemory":{"$ref":"#/$defs/metric"},"cpu":{"$ref":"#/$defs/metric"}}},"observations":{"type":"object","additionalProperties":false,"required":["filesystem","processes","networkObservationStatus","sandboxNetworkPolicy","resources"],"properties":{"filesystem":{"type":"array","items":{"$ref":"#/$defs/file"}},"processes":{"type":"array","items":{"$ref":"#/$defs/process"}},"networkObservationStatus":{"enum":["UNAVAILABLE"]},"sandboxNetworkPolicy":{"enum":["DENY"]},"resources":{"$ref":"#/$defs/resources"}}},"intelligence":{"type":"object","additionalProperties":false,"required":["provider","status","sourceIdentifier","findings"],"properties":{"provider":{"type":"string"},"status":{"type":"string"},"sourceIdentifier":{"type":["string","null"]},"findings":{"type":"array","items":{"type":"string"}}}},"policy":{"type":"object","additionalProperties":false,"required":["outcome","findings"],"properties":{"outcome":{"enum":["NO_POLICY_FINDING","REVIEW_REQUIRED","POLICY_DENIED"]},"findings":{"type":"array","items":{"type":"string"}}}},"capability":{"type":"object","additionalProperties":false,"required":["status","backend"],"properties":{"status":{"enum":["SUPPORTED","PARTIAL","UNAVAILABLE","ENFORCED"]},"backend":{"type":["string","null"]}}},"capabilities":{"type":"object","additionalProperties":false,"required":["filesystemObservation","processObservation","networkObservation","networkSandboxPolicy"],"properties":{"filesystemObservation":{"$ref":"#/$defs/capability"},"processObservation":{"$ref":"#/$defs/capability"},"networkObservation":{"$ref":"#/$defs/capability"},"networkSandboxPolicy":{"$ref":"#/$defs/capability"}}},"methodology":{"type":"object","additionalProperties":false,"required":["evidenceSchemaVersion","verificationMethodologyVersion","normalizationVersion","depguardVersion","observerVersion","sandboxVersion"],"properties":{"evidenceSchemaVersion":{"const":"1"},"verificationMethodologyVersion":{"const":"1"},"normalizationVersion":{"const":"1"},"depguardVersion":{"type":"string","minLength":1},"observerVersion":{"type":"string","minLength":1},"sandboxVersion":{"type":"string","minLength":1}}},"missingEvidence":{"type":"object","additionalProperties":false,"required":["kind","reason"],"properties":{"kind":{"type":"string","minLength":1},"reason":{"type":"string","minLength":1}}}}}
