{"artifacts":{"baselineArtifactDigest":"sha256:aaaaaaaaaaaaaaaaaaaaaaaaaaaaaaaaaaaaaaaaaaaaaaaaaaaaaaaaaaaaaaaa","baselineDependencyGraphDigest":"sha256:eeeeeeeeeeeeeeeeeeeeeeeeeeeeeeeeeeeeeeeeeeeeeeeeeeeeeeeeeeeeeeee","baselineLockfileDigest":"sha256:cccccccccccccccccccccccccccccccccccccccccccccccccccccccccccccccc","baselineRegistryIntegrity":"sha512-baseline","behaviorEvidenceDigest":"sha256:1111111111111111111111111111111111111111111111111111111111111111","candidateArtifactDigest":"sha256:bbbbbbbbbbbbbbbbbbbbbbbbbbbbbbbbbbbbbbbbbbbbbbbbbbbbbbbbbbbbbbbb","candidateDependencyGraphDigest":"sha256:ffffffffffffffffffffffffffffffffffffffffffffffffffffffffffffffff","candidateLockfileDigest":"sha256:dddddddddddddddddddddddddddddddddddddddddddddddddddddddddddddddd","candidateRegistryIntegrity":"sha512-candidate"},"capabilities":{"filesystemObservation":{"backend":"snapshot-diff","status":"SUPPORTED"},"networkObservation":{"backend":null,"status":"UNAVAILABLE"},"networkSandboxPolicy":{"backend":"docker-network-none","status":"ENFORCED"},"processObservation":{"backend":"docker-process-polling","status":"PARTIAL"}},"environment":{"architecture":"x86_64","containerImageDigest":null,"containerImageReference":"node:20-alpine","os":"linux","packageManager":"npm","runtime":"node","sandboxBackend":"docker"},"externalIntelligence":[{"findings":[],"provider":"osv","sourceIdentifier":null,"status":"unavailable"}],"methodology":{"depguardVersion":"0.2.0","evidenceSchemaVersion":"1","normalizationVersion":"1","observerVersion":"docker-process-polling-v1","sandboxVersion":"docker-v1","verificationMethodologyVersion":"1"},"missingEvidence":[{"kind":"network-observation","reason":"observer-not-implemented"}],"observations":{"filesystem":[{"executable":false,"kind":"file","path":"candidate-marker.txt","sha256":"sha256:2222222222222222222222222222222222222222222222222222222222222222","size":7}],"networkObservationStatus":"UNAVAILABLE","processes":[{"arguments":["test"],"executable":"node","exit_code":1,"parent_executable":"npm"}],"resources":{"cpu":{"milliseconds":null,"status":"UNAVAILABLE"},"peakMemory":{"milliseconds":null,"status":"UNAVAILABLE"},"wallTime":{"milliseconds":321,"status":"OBSERVED"}},"sandboxNetworkPolicy":"DENY"},"policy":{"findings":["candidate test failed"],"outcome":"REVIEW_REQUIRED"},"schema":"1","subject":{"baseline":{"purl":"pkg:npm/example-package@1.0.0","version":"1.0.0"},"candidate":{"purl":"pkg:npm/example-package@2.0.0","version":"2.0.0"},"ecosystem":"npm","package":"example-package"},"verification":{"baseline":[{"exitCode":0,"name":"test","status":"PASSED"}],"candidate":[{"exitCode":1,"name":"test","status":"FAILED"}]}}
